{
  "schemaVersion": 1,
  "scoreId": "automatic",
  "segment": { "id": "intro-m3", "sourcePage": 1, "sourceSystem": 1, "measureStart": 3, "measureEnd": 3 },
  "ppq": 480,
  "measures": [
    { "number": 3, "durationTicks": 1920, "timeSignature": { "beats": 4, "beatType": 4 }, "key": { "fifths": -3, "mode": "minor" }, "tempoBpm": 96, "pickupTicks": 0 }
  ],
  "chords": [
    { "measure": 3, "onsetTick": 0, "durationTicks": 960, "symbol": "Fmin7", "root": "F", "bass": null, "quality": "min7" },
    { "measure": 3, "onsetTick": 960, "durationTicks": 960, "symbol": "Cm7", "root": "C", "bass": null, "quality": "minor7" }
  ],
  "melody": [
    { "measure": 3, "onsetTick": 480, "durationTicks": 240, "midi": 65, "tie": "none" },
    { "measure": 3, "onsetTick": 720, "durationTicks": 240, "midi": 68, "tie": "none" },
    { "measure": 3, "onsetTick": 960, "durationTicks": 360, "midi": 71, "tie": "none" },
    { "measure": 3, "onsetTick": 1320, "durationTicks": 120, "midi": 72, "tie": "start" },
    { "measure": 3, "onsetTick": 1680, "durationTicks": 240, "midi": 68, "tie": "none" }
  ],
  "structure": {
    "timeSignatures": [{ "measure": 3, "onsetTick": 0, "beats": 4, "beatType": 4 }],
    "keys": [{ "measure": 3, "onsetTick": 0, "fifths": -3, "mode": "minor" }],
    "tempos": [{ "measure": 3, "onsetTick": 0, "bpm": 96 }],
    "navigation": [
      { "measure": 3, "onsetTick": 0, "kind": "coda", "targetMeasure": null, "endingNumbers": [], "repeatCount": null }
    ],
    "playbackOrder": [3]
  },
  "warnings": [
    { "measure": 3, "field": "chord.rawSymbol", "code": "normalized-spelling", "message": "Raw chord spelling differs from the expected score text." },
    { "measure": 3, "field": "melody.tie", "code": "low-confidence-tie", "message": "Tie recognition is uncertain." },
    { "measure": 3, "field": "structure.key", "code": "low-confidence-key", "message": "Key signature may be incomplete." },
    { "measure": 3, "field": "structure.navigation", "code": "unexpected-coda", "message": "Coda mark may be a false positive." }
  ]
}
